{
  "schema_version": "passage-pilot-v1",
  "job_id": "challenge-02",
  "episode": {
    "genre": "halachic",
    "genre_reason": "The passage tests a ruling about found wine against an earlier rule.",
    "form": "Case ruling, proposed objection, and answer",
    "coverage": "needs_context",
    "needed_context": [
      "The earlier statement of Rabbi Hanina is needed to specify the rule under discussion."
    ],
    "notes": []
  },
  "mentions": [
    {
      "id": "m1",
      "kind": "name",
      "anchor": {
        "source_id": "s1",
        "quote": "רבא",
        "occurrence": 1
      }
    },
    {
      "id": "m2",
      "kind": "name",
      "anchor": {
        "source_id": "s1",
        "quote": "רבי חנינא",
        "occurrence": 1
      }
    },
    {
      "id": "m3",
      "kind": "description",
      "anchor": {
        "source_id": "s1",
        "quote": "לימא",
        "occurrence": 1
      }
    },
    {
      "id": "m4",
      "kind": "group",
      "anchor": {
        "source_id": "s2",
        "quote": "דשפוכאי ישראל נינהו",
        "occurrence": 1
      }
    },
    {
      "id": "m5",
      "kind": "group",
      "anchor": {
        "source_id": "s2",
        "quote": "מעוברי דרכים",
        "occurrence": 1
      }
    },
    {
      "id": "m6",
      "kind": "description",
      "anchor": {
        "source_id": "s1",
        "quote": "בי קופאי",
        "occurrence": 1
      }
    },
    {
      "id": "m7",
      "kind": "description",
      "anchor": {
        "source_id": "s1",
        "quote": "זיקי דחמרא",
        "occurrence": 1
      }
    }
  ],
  "entities": [
    {
      "id": "rava",
      "kind": "person",
      "label": "Rava",
      "mention_ids": [
        "m1"
      ],
      "evidence": [
        {
          "source_id": "s1",
          "quote": "רבא",
          "occurrence": 1
        }
      ],
      "branches": []
    },
    {
      "id": "hanina",
      "kind": "person",
      "label": "Rabbi Hanina",
      "mention_ids": [
        "m2"
      ],
      "evidence": [
        {
          "source_id": "s1",
          "quote": "רבי חנינא",
          "occurrence": 1
        }
      ],
      "branches": []
    },
    {
      "id": "editor",
      "kind": "group",
      "label": "Unnamed discussion voice",
      "mention_ids": [
        "m3"
      ],
      "evidence": [
        {
          "source_id": "s1",
          "quote": "לימא",
          "occurrence": 1
        }
      ],
      "branches": []
    },
    {
      "id": "winepourers",
      "kind": "group",
      "label": "Local wine pourers, mostly Israelites",
      "mention_ids": [
        "m4"
      ],
      "evidence": [
        {
          "source_id": "s2",
          "quote": "דשפוכאי ישראל נינהו",
          "occurrence": 1
        }
      ],
      "branches": []
    },
    {
      "id": "travelers",
      "kind": "group",
      "label": "Passersby proposed as owners of small containers",
      "mention_ids": [
        "m5"
      ],
      "evidence": [
        {
          "source_id": "s2",
          "quote": "מעוברי דרכים",
          "occurrence": 1
        }
      ],
      "branches": []
    },
    {
      "id": "site",
      "kind": "place",
      "label": "בי קופאי, the place description as given",
      "mention_ids": [
        "m6"
      ],
      "evidence": [
        {
          "source_id": "s1",
          "quote": "בי קופאי",
          "occurrence": 1
        }
      ],
      "branches": []
    },
    {
      "id": "wine",
      "kind": "object",
      "label": "Found wine containers",
      "mention_ids": [
        "m7"
      ],
      "evidence": [
        {
          "source_id": "s1",
          "quote": "זיקי דחמרא",
          "occurrence": 1
        }
      ],
      "branches": []
    },
    {
      "id": "permit",
      "kind": "statement",
      "label": "The found wine containers are permitted",
      "mention_ids": [],
      "evidence": [
        {
          "source_id": "s1",
          "quote": "שרנהו רבא",
          "occurrence": 1
        }
      ],
      "branches": []
    },
    {
      "id": "hanina_rule",
      "kind": "statement",
      "label": "Rabbi Hanina’s rule, not stated in this excerpt",
      "mention_ids": [],
      "evidence": [
        {
          "source_id": "s1",
          "quote": "לדרבי חנינא",
          "occurrence": 1
        }
      ],
      "branches": []
    },
    {
      "id": "majority",
      "kind": "statement",
      "label": "Most local wine pourers are Israelites",
      "mention_ids": [],
      "evidence": [
        {
          "source_id": "s2",
          "quote": "דשפוכאי ישראל נינהו",
          "occurrence": 1
        }
      ],
      "branches": []
    },
    {
      "id": "limits",
      "kind": "statement",
      "label": "Large containers are covered; small ones may be from passersby, except when accompanying large ones",
      "mention_ids": [],
      "evidence": [
        {
          "source_id": "s2",
          "quote": "וה\"מ ברברבי אבל זוטרי אימור מעוברי דרכים נפול ואי איכא רברבי בהדייהו אימור באברורי הוה מנחי:",
          "occurrence": 1
        }
      ],
      "branches": []
    },
    {
      "id": "find",
      "kind": "event",
      "label": "Finding wine containers at בי קופאי",
      "mention_ids": [],
      "evidence": [
        {
          "source_id": "s1",
          "quote": "הנהו זיקי דחמרא דאשתכחן בי קופאי",
          "occurrence": 1
        }
      ],
      "branches": []
    },
    {
      "id": "loss",
      "kind": "event",
      "label": "Possible loss of small containers by passersby",
      "mention_ids": [],
      "evidence": [
        {
          "source_id": "s2",
          "quote": "אימור מעוברי דרכים נפול",
          "occurrence": 1
        }
      ],
      "branches": []
    }
  ],
  "claims": [
    {
      "id": "c1",
      "family": "views",
      "predicate": "holds_view",
      "subject": "rava",
      "object": "permit",
      "roles": [],
      "evidence": [
        {
          "source_id": "s1",
          "quote": "שרנהו רבא",
          "occurrence": 1
        }
      ],
      "branches": [],
      "voice": "narrator",
      "polarity": "positive",
      "modality": "asserted",
      "discourse_status": "stated",
      "basis": "explicit",
      "reading_confidence": "high",
      "identity_confidence": null,
      "historical_confidence": null,
      "subtype": null,
      "time_scope": null,
      "notes": []
    },
    {
      "id": "c2",
      "family": "transmission",
      "predicate": "attributes_to",
      "subject": "hanina_rule",
      "object": "hanina",
      "roles": [],
      "evidence": [
        {
          "source_id": "s1",
          "quote": "לדרבי חנינא",
          "occurrence": 1
        }
      ],
      "branches": [],
      "voice": "narrator",
      "polarity": "positive",
      "modality": "asserted",
      "discourse_status": "stated",
      "basis": "explicit",
      "reading_confidence": "high",
      "identity_confidence": null,
      "historical_confidence": null,
      "subtype": null,
      "time_scope": null,
      "notes": []
    },
    {
      "id": "c3",
      "family": "views",
      "predicate": "opposes",
      "subject": "rava",
      "object": "hanina_rule",
      "roles": [],
      "evidence": [
        {
          "source_id": "s1",
          "quote": "לימא לא סבר לה לדרבי חנינא",
          "occurrence": 1
        }
      ],
      "branches": [],
      "voice": "editor",
      "polarity": "positive",
      "modality": "question",
      "discourse_status": "rejected",
      "basis": "explicit",
      "reading_confidence": "high",
      "identity_confidence": null,
      "historical_confidence": null,
      "subtype": null,
      "time_scope": null,
      "notes": [
        "This is a proposed inference from the ruling, answered by the majority explanation. It does not establish disagreement."
      ]
    },
    {
      "id": "c4",
      "family": "views",
      "predicate": "explains",
      "subject": "majority",
      "object": "permit",
      "roles": [],
      "evidence": [
        {
          "source_id": "s2",
          "quote": "דשפוכאי ישראל נינהו",
          "occurrence": 1
        }
      ],
      "branches": [],
      "voice": "narrator",
      "polarity": "positive",
      "modality": "asserted",
      "discourse_status": "stated",
      "basis": "interpretation",
      "reading_confidence": "high",
      "identity_confidence": null,
      "historical_confidence": null,
      "subtype": null,
      "time_scope": null,
      "notes": [
        "The sentence continues שאני התם דרובא from the preceding source."
      ]
    },
    {
      "id": "c5",
      "family": "views",
      "predicate": "explains",
      "subject": "limits",
      "object": "permit",
      "roles": [],
      "evidence": [
        {
          "source_id": "s2",
          "quote": "וה\"מ ברברבי אבל זוטרי אימור מעוברי דרכים נפול ואי איכא רברבי בהדייהו אימור באברורי הוה מנחי:",
          "occurrence": 1
        }
      ],
      "branches": [],
      "voice": "narrator",
      "polarity": "positive",
      "modality": "asserted",
      "discourse_status": "stated",
      "basis": "explicit",
      "reading_confidence": "high",
      "identity_confidence": null,
      "historical_confidence": null,
      "subtype": null,
      "time_scope": null,
      "notes": []
    },
    {
      "id": "c6",
      "family": "scenes",
      "predicate": "participates_in",
      "subject": "travelers",
      "object": "loss",
      "roles": [],
      "evidence": [
        {
          "source_id": "s2",
          "quote": "אימור מעוברי דרכים נפול",
          "occurrence": 1
        }
      ],
      "branches": [],
      "voice": "narrator",
      "polarity": "positive",
      "modality": "hypothetical",
      "discourse_status": "proposed",
      "basis": "explicit",
      "reading_confidence": "high",
      "identity_confidence": null,
      "historical_confidence": null,
      "subtype": "dropped_containers",